,fraudulent,requirements
10878,f,"required qualifications: high school diploma or equivalent (ged) required minimum of one year customer service related experience required keyboarding and windows environment pc skills required strong financial acumen required ability to excel in a fast-paced, multi-tasking, team environment excellent communication skills both verbal and written ability to effectively work independently and in a team environment competency in performing multiple functional tasks creative thinker outstanding work ethic target-driven enthusiastic and passionate heavy lifting up to55 pounds standing for long periods of time significant walking ability to meet attendance policy availability to work additional hours if needed successful completion of a pre-employment drug screening, employment history check, and criminal background check "
8573,t,nann
11753,t,b.s. in chemical engineering required with 3 to 10 years experience in refining or petrochemical sectors.
13491,f,"this could be the job for you, if you enjoy: makinggloriouschecklists andtriple checkingyour work running with fast-paced, gut decisions to move projects forward with the highest standards, then cheerfully explaining why your solution is awesome. implementing plans that work for both the customer and our deadlines - all while balancing ourhighquality standards. taking super-detailed notes and organizing them each day. never letting the small details fall through the cracks for your 40 open app projects. neat freaks are preferred.your ability to organize your work and communicate effectively will set you apart from the pack. you will be creating, enforcing, and reminding customers of their deadlines on a daily basis. you love routines so much, you may feel like a human calendar. "
6535,f,"skills: ·expertise in utilizing technical tools (i.e. sql, unix, teradata, etc). ·experience with sas, oracle is highly preferred ·experience with metadata, quality data analysis ·applies advanced principles, theories, and concepts. ·ability to take unclear requirements and drive towards results. ·develops solutions to complex problems, which require the regular use of ingenuity and creativity. experience 10+ years of experience in sql, unix. 8+ years of experience in teradata. 8+ years of experience in data warehousing. "
4108,f,"1 year of telecommunications experience, or 1 year combination of training and experience. a basic knowledge of installation techniques of data/voice cable and equipment. must possess a state issued drivers license with a clean mvd driving record. physical demands: occasional lifting, carrying, pushing, and/or pulling up to 75lbs.; some climbing and balancing; frequent stooping, kneeling, crouching, and/or crawling; and significant fine finger dexterity. able to follow instructions. able to persist and finish projects despite obstacles. able to follow instructions. able to take extra steps to prevent mistakes. must pass a background check and drug screen. must possess a high school diploma or ged equivalent. "
11695,f,the successful candidate will possess: • a high level of detail orientation • an effective communicator • a skilled multi-tasker • a problem solver
11379,f,nann
16678,f,"skill set required: strong development experience in java. experience in jsp, ejb, struts, web services and weblogic. should have experience in sql server. banking experience is mandatory. experience in sharepoint and equation will be an added advantage.. "
2128,f,"your background: you are the most charming person in the world that enjoys making sure that other people have a great time you have excellent skills in project management and organisation you like to work in an international work environment you can work independent and feel comfortable to take your own decisions you are a master in office software (excel, word, powerpoint, keynote) you are fluent in english (lhbs company language) and german you are an inspiring personality that adds to our company culture "
17823,t,"what you need:you'll thrive on working in a fast paced, dynamic telesales environment - making outbound calls, qualifying customer requirements.the most successful members of the existing telesales team are enthusiastic, target driven and self-motivated people with a confident approach and a desire to earn good money. we're looking for people who can come straight in and be a top performer, so a similar personality is essential.as this call centre role involves cold calling you'll need to approach each call as if it was the first one of the day, tenacity and resilience are therefore essential. you'll need to prove this to us in your interview and show us evidence of your success in the past."
6373,f,"normal 0 false false false en-us x-none x-none microsoftinternetexplorer4 /* style definitions */ {mso-style-name:""table normal""; mso-tstyle-rowband-size:0; mso-tstyle-colband-size:0; mso-style-noshow:yes; mso-style-priority:99; mso-style-parent:""""; mso-padding-alt:0in 5.4pt 0in 5.4pt; mso-para-margin:0in; mso-para-margin-bottom:.0001pt; mso-pagination:widow-orphan; font-size:10.0pt; font-family:""times new roman"",""serif"";} skills: financial experince (trading, investment) • has a computer science, electrical engineering, or similar degree • is familiar with object-oriented development, with specific experience in at least one major oo language (e.g., java, c, c++) • understands general software design principles patterns • understands systems integration principles patterns • strong relational database/sql experience • etl (nice-to-have) • markit edm experience (nice-to-have) • experience in finance industry (nice-to-have)"
1496,f,nann
13961,f,"ba/bs in finance, accounting, or business. five years of experience supervising personnel in a fast-paced retail inventory environment. ability to work under pressure in a detailed, organized manner, and takes initiative and ownership of their role excellent communication skills (both written), strong ability to present information and make recommendations to the executive leadership team. travel may be required, and be computer savvy "
7316,t,axure illustrator
15191,f,"proficiency in html/html5 and css/css3. very good knowledge of javascript. excellent knowledge of web standards and best practices. passion for clean, standards compliant and fast html css code. excellent communication skills in english, particularly written communication. previous experience in software development. previous experience in product development is considered a plus. experience with django or is a plus. "
14309,f,"you will be the number one telephone sales rep where you work currently. call me now on 0800 3000 31, press option 9 and convince me to hire you."
15739,f,nann
7473,t,nann
7932,f,"qualifications minimum qualifications: bachelor's degree in cis, mis, computer science or it related field 4years of experience with software development using java 4+ years of experience using sql ability to work in a team environment and mentor newassociates strong communication skills; written and verbal ability to work overtime and irregular hours when needed ability to learn and apply new technical skills and concepts quickly strong critical thinking and systematic problem solving skills live or willing to relocate to the kansas city area preferred qualification: experience with map/reduce processing on hadoop/hbase experience with oracle and mysql experience with hive "
17453,f,"requirements thorough understanding of ruby, rails and oop. competent with javascript. adept at bdd/tdd practices. good understanding of html and css. experience with relational databases and handling variable volumes of data. proven experience building solid full-stack web applications with code you are proud of. "
4261,f,"the ideal candidate: is experienced in javascript, jquery, css (css3), html (html5), xhtml, ajax. is experienced in php and other web programming languages. is experienced in sql manipulating databases (mysql). is able to build online solutions 'by hand' without the use of wysiwyg tools. is familiar with the concepts of 'graceful degradation' and 'progressive enhancement' and applies them to all developed code. tests and maintains 'cross-browser compatibility' in all developed code. codes to industry standards (w3c) and follow in-house standards. is kept always up-to-date on emerging technologies and revisions to existing standards, where applicable, including accessibility and usability issues, and their implications on interface development. can liaise with other web developers, project managers, designers, and hosting. has a good eye for detail, and make a concerted effort to faithfully reproduce the agreed design of the site, and alert the project manager when this is not practical or achievable. has ideas on his/her own with the ability to drive them to full completion with minimum supervision (self-starter and self-motivated). is willing to learn new techniques. has working knowledge of how to extract/manipulate image files for online use using graphic editors (photoshop, illustrator, etc.). has working knowledge of cms and templating systems. is knowledgeable in object-oriented programming, patterns and frameworks. is knowledgeable in xml. is fluent in english writing. "
3179,t,"requirements all you need is access to the internet and you can participate.computer with internet access, valid email address, good typing skills "
6224,f,"excellent proficiency in the following: semantic (x)html, table-less css (syntax and application), the parse tree/dom (and how css and js interacts with and affects it). familiarity with html5 preferred. working knowledge of php and javascript preferred. must understand how these technologies are used on the web and have a familiarity with programming ideals. bonus points for experience writing applications/functions in extjs or jquery (not just modifying existing plugins) experience building website templates(cutups) from layered design comps preferred and/or experience modifying them knowledge of browser differences/limitations and how to create cross-browser solutions. 1+ years experience working in a professional, team-oriented environment and/or experience working on commercial sites knowledge of content management systems and what they offer; experience building templates or editing content within them preferred. strong attention to detail and quality assurance required able to work on multiple projects and work to deadlines strong design aesthetic also a plus "
16884,f,"technical you should have education or experience with software development. some of the technologies we use include ruby, rails, postgres, javascript, angularjs, bootstrap, twilio, and pusher. it's not required that you know any (or all) of these, but you should be prepared to demonstrate what you do know, and you should be eager to learn. you'll also diagnose issues on client websites, which will require familiaritywith javascript, html, css. our product integrates tightly with google analytics, google adwords, and third party products via our webhooks and rest api, so knowledge of those products is a plus. communication you'll communicate directly with customers via email and on the phone, so your written and verbal communication should be crisp, friendly, and confidence-inspiring. you'll explain complex topics to clients with varying levels of technical expertise. culture we're a small team focused on building the best product and backing it up with exceptional service. we work independently -- sometimes in the office, sometimes remotely. you should be intrinsically motivated to do great work and have a drive to improve constantly."
5238,f,"required education experience1. high school diploma or equivalent preferred education experience1. previous experience as a dietary assistant other competencies (skills, abilities, behavior) ability to understand and follow both written and oral instructions. adaptability to perform routine, repetitive tasks within a specific period of time. prioritizes work assignments to be completed within time requirements. cleanliness in person and habits, initiative, dependable, ability to work efficiently and harmoniously with others. must demonstrate a positive and caring attitude toward residents and staff. must remain flexible and adaptable in order to meet department needs. background check and drug screening it is the policy of lafayette habilitation center to provide and ensure a safe and secure environment for all members of the facility and its property. as part of this mandate, background checks and drug screening will be required of prospective employees who may or may not have already received a bona fide offer of employment. "
16345,f,nann
6447,f,nann
15,f,"key superpowers 3-5 years of high-pressure sales experience, but if you absorb knowledge like a sponge and keep getting promoted we are flexible preferably mastery of both phone and field sales for both business and retail customers know the ins and outs of crm 'get tech,' we are a tech company at heart. you know the finer points of powerpoint formatting and how to install dropbox yourself (yes, seriously, that's apparently a thing) entrepreneurial spirit winner mindset persuasion self motivation resilience and tenaciousness working well under stress goal driven preferable: knowledge and connections in singapore and across more developed cities teleportation (optional) "
12740,f,"about you: a great conceptual thinker with searing insight and problem solving skills. a keen eye for detail and an impatience for the imperfect. highly collaborative, a true pragmatist and diplomat. fresh and positive outlook on life. an exceptional attention to detail excellent communication and problem solving skills. qualifications experience across both mobile apps and web apps which have scaled demonstrate deep understanding of ux and ecommerce best practices demonstrate deep understanding of agile development process excellent communication and interpersonal skills know what it truly means to own and care about your product ideally you have been in a high growth environment a technical background would be beneficial "
9879,f,"1-3 years of applicable experience. exceptional communication skills, oral and written. self-motivated, results-orientated and hard-working. this isn’t a micromanaged position, success will depend on your willingness to achieve. ability to see the big picture while being able to drill into the details and execute on specifics to achieve success. "
17802,t,"mange train front desk staff providing services to guests in a friendly, efficient professional manner.we are looking for anexperienced personwith customer service and management skills, an enthusiastic personality who loves animals people!must have a minimum of an associate's degree. higher degrees are preferred.must have excellent communication skills, sales-abilities a plus.must have experience with heavy phones, customer service and an upbeat personality.computer knowledge required, will teach our program but must be proficient at word excel."
12808,f,you will also have the following: a thorough knowledge of the south island heavy transport industry an excellent reputation as a reliable and customer-focused sales professional a good technical understanding of transport industry product able to make good sales decisions based on the required business outcomes. enjoy working with cutting edge technologies. if you enjoy the challenges and responsibilities of working within a highly motivated and knowledgeable sales team and thrive in a fast-paced work environment we want to hear from you.
13019,f,"b.s. in computer science or equivalent experience (proven ability matters more to us than degrees) fluent in at least one dynamically-typed, object-oriented language (e.g. ruby, python) several years experience with a modern web framework such as rails or django "
11759,t,b.s. in mechanical engineering required with 3 to 10 years experience in refining or petrochemical sectors.
5570,f,"you will... have a real passion for reaching the end user have demonstratable experience with android or ios operating systems have completed or be near completion of a degree in computer science, engineering or related technical field experience developing software using object oriented languages (java, objective-c, c++, c, or similar) understanding and exposure to web technologies such as html5, rest, css and javascript proven understanding of software development techniques, concepts and process be interested in learning new skills not be afraid to share ideas or ask for help enjoy participating in group discussions enjoy getting out there and testing our products! it would be cool if you also had... experience in mobile interface design and development (wireframes etc) experience using adobe create suite of tools experience working in an agile environment "
5609,f,"the ideal candidate will have 3+ years of sqa or system test experience, as well as experience in the following areas : experience with hardware and/or software development lifecycle processes experience with testing embedded consumer electronics or wireless mobile devices proven ability to develop test automation using python, perl, unix shell or other relevant scripting languages c/c++ or other relevant programming languages ability to work with cross-functional and remote teams demonstrates qa skills with at least 2 complete product cycles, from inception to customer shipment education (bsee/cs or equivalent experience) "
9730,f,"who you are… you have a degree in video production or related field or at least one year of video production experience (required). you have experience with adobe creative suite (including adobe premier and after effects) and screen recording software. you have experience operating video/photography equipment. this includes the ability to select the appropriate lens and lighting combinations for various shooting scenarios (interior/exterior). you have top notch conceptual, writing, and editing skills. you’re a self-started who takes pride in your work. you thrive in a dynamic, fast-paced environment. time management is a priority for you. you can handle a variety of assignments simultaneously. you can speak to people with finesse. a looming deadline doesn't shake you. eoe"
788,f,"1. you have a killer marketing instinct 2. you know how to sell 3. you understand human psychology 4. marketing background from university 5. swot analysis 6. porter 5 forces 7. excellent english ability – written and oral 8. doer and superb organizer 9. know, understand, and love technology! 10. love to tweet/blog since this is marketing position, please show us what you got in your cover letter. you need to be able tomarket yourself first before you could market anything else. p.s. we are a big fan of don draper (google mad men)"
10748,f,"qualifications: degree in purchasing and supply chain or related discipline. 5+ years’ experience or knowledge in purchase/procurement of housewares/kitchenware products in a multinational company. experience in product development (rd) and purchasing plans for new product development. background in fda and lfgb-laws is preferable strong cost control, management and analytical skills. good english communication skills. "
4620,f,"5+ years of experience working large scale applications worked on collaborative software projects proficient in several programing languages strong experience building restful web services deep knowlege of several datastore technologies and paradigms experience writing asynchronous code able to utilize version control while sleeping religious about writing unit tests and testable code excellent problem solving, critical thinking and communication skills "
6043,f,nann
11059,f,"minimum requirements: minimum of 6 months customer service related experience required high school diploma or equivalent (ged) required preferred qualifications: 6 months of inserting experience preferred keyboarding and windows environment pc skills required (word, excel and powerpoint preferred) experience running mail posting equipment a plus excellent communication skills both verbal and written lifting up to 55 lbs with or without accommodations willingness and availability to work additional hours if assigned willingness to submit to a pre-employment drug screening and criminal background check ability to effectively work individually or in a team environment competency in performing multiple functional tasks ability to meet employer's attendance policy "
6332,f,"minimum requirements: minimum of 6 months customer service related experience required high school diploma or equivalent (ged) required preferred qualifications: keyboarding and windows environment pc skills required (word, excel and powerpoint preferred) experience running mail posting equipment a plus excellent communication skills both verbal and written lifting up to 55 lbs with or without accommodations willingness and availability to work additional hours if assigned willingness to submit to a pre-employment drug screening and criminal background check ability to effectively work individually or in a team environment competency in performing multiple functional tasks ability to meet employer's attendance policy "
12608,f,"business challenge:they need to create one comprehensive application that will aggregate information from multiple points into a seamless portal for internal and external use.evp:opportunity to work for an industry leader and endless room for advancement.non-technical skills: -must be dependable, analytical, accurate and detail oriented- must have excellent verbal and written communication skillswhy is position open?: the current developers are focused on support of the legacy crm system. they need new developers to come in and deliver on the new applications.project stage/lifecycle info:technical environment: c, .net, sql"
17573,t,won't required experience for this job.
7031,f,"experience in testing mobile apps a desire for perfection and a keen eye to find flaws both in function and form awareness of where bugs will normally appear in a mobile application experience with bug tracking tools experience working as a tester within an agile team a good sense of humour able to motivate colleagues passion for testing ui and interaction knowledge of project management tools, such as basecamp, jira, trac, unfuddle "
9841,t,"basic qualifications: proven experience in management of digital ad delivery, optimization and/or yield management ability to prioritize multiple tasks and meet deadlines with demonstrated initiative strong initiative and ability to work well under pressure while maintaining good attitude ability to work well independently define/manage objectives in a fast paced environment ability to maintain excellent internal and external client relationships proficiency in ms office suite, with an emphasis in excel ba/bs degree minimum 3 years of relevant client services management position in the digital ad space preferred qualifications: 5 years related experience in online advertising strong understanding in leading ad servers and ad networks an understanding of video media and knowledge of programmatic transactions "
12718,f,"qualifications: must have business-to-business sales experience must have proven track record of setting and exceeding goals. demonstrates a positive attitude and passion for success. demonstrates excellent follow-up and organizational skills. have excellent written and oral communication skills. in depth understanding of all facets of the sales process from lead generation, close, into account management and development. must be comfortable with client-facing, consultative interaction with management and senior leadership to develop the appropriate solution and close the business with the client. desired attributes: knowledge of/experience with structured sales methodologies, e.g., strategic selling, solution selling, spin, power based selling, target account selling. a “hunter” mentality with strong phone skills. developed specialized business strong desire for continued education and trend tracking relevant to telecom/wireless. client would prefer candidates for this role be located in the northeast or possibly midwest. "
11037,t,nann
8302,f,"years of experience: minimum of 1 year public relations and/or marketing experience preferred education: bachelor's degree inpr, communications, marketing strong written and oral communication skills ability to speak comfortably with media proficiency in ms office: word, excel, powerpoint experience and proficiency with social media outlets must be able to workindependently and with a team, as well as work towards short andlong-term goals. easily build relationships and are personable, comfortable networking, creative,results-oriented, and have impeccable follow-through. "
3923,f,at least five (5) ordinary level cxc / gce subjects including english language andmathematics. office procedures. at least one (1) years’ experience in a similar field in a related industry. 
4301,f,"you have strong project management skills you have a meticulous attention to detail you have strong interpersonal skills you’re a very quick learner you drive new initiates through and take a lot of ownership for your work you’reversatile, flexible and aren’t afraid to get your hands dirty you're willing and flexible enough to fly overseas (india, china, vietnam) to work at short notice you have a solid passion for interior design and furniture you’re interested in breaking new ground you’re focused on results (we’re not fans of micro management) you’re a really nice person. "
