,fraudulent,requirements
16134,f,nann
9915,f,excellent written english permitted to work in uk ability to work well under pressure ability to work on own initiative ability to work within a team ability and desire to learn new skills 
17560,t,freelancer working in saudi arabia.
6846,t,"an ambition to succeed, a desire to be the best at our field and not be discourage when people turn you down. if you have these qualities than you are perfect for this business"
5168,f,nvq level 5 care manager / registered manager experience
1330,f,nann
16046,f,"currently enrolled in a bachelor's or master's degree program, or you just finished your studies. ability to commit to a minimum of 8 weeks and up to 3 months at previous experience in sales, advertising, consulting, analysis, customer service, marketing, finance, technology or related fields. you have an entrepreneurial mindset, are a team player, but you also have the ability to work without constant coaching "
17707,t,"bottom line requirements: 1.expert in edi (850, 860, 870, 855) using inovis software. 2.programming experience in cognos, sql reporting, and crystal reporting. 3.business intelligence development(data etl, mapping, analysis service and reporting). 4.experience with networking (pc) and cabling, microsoft exchange server,barracuda email archive software, windows products and any business intelligence software. 5.experience using ms sql, server ssis, ssas, ssrs, ms sharepoint. knowledge of as400/rpg 400 is a plus."
12805,f,"we're looking for people who love ios, who love the startup culture or want to experience it. you will understand api's, mobile development environments, service orientated architecture and a whole lot more and if you don't we can help. ideally you will have led a small team or acted in a lead or senior role and be looking to fully play that part in your next role. will you need a cs degree from oxford, not really as long as you can demonstrate your ability to think, reason and come up with great solutions. we are open on almost everything else, we believe great developers are made not born and its a passion, we have it and we want others with it to join us."
962,f,"2+ years of web design experience demonstrable graphic design skills with a strong portfolio solid experience in creating wireframes, storyboards, user flows, process flows and site maps proficiency in photoshop, illustrator, or other visual design and wire-framing tools proficiency in html, css, and javascript for rapid prototyping. excellent visual design skills with sensitivity to user-system interaction​ ability to solve problems creatively and effectively up-to-date with the latest web trends, techniques, and technologies "
1843,t,"6 months to a year experience working in a fast pace, back to back call handling in a call center environment.high comfort level with computer-based work. google applications knowledge and netsuite or similar crm/ticketing software a plus.must be able to multitask between various web applications.passionate about providing stellar service to customers.the ability to be as friendly and helpful at the end of an 8-hour shift as in the beginning of the shift.ability to work at a fast pace while maintaining accuracy.great attention to detail, and a high sense of urgency.excellent written and verbal communication skills.ability to work various shifts during a 24 hour period, as schedules may vary from week to week. : solid record of good attendance at prior employer's references.all applications must be received online. no walk-ins or phone calls accepted. due to the volume of applicants, we are unable to accept phone or email inquiries on application status. applicants must follow these requirements in order to be considered."
17580,t,"good typing speed,some clerical and administrative work is required"
12609,f,"you have most of the following qualifications: proficiency in javascript and familiarity with common libraries hands on experience skilled in front-end development with html, css, and javascript. unit testing for javascript code (front or back end). you're experienced and comfortable with technical assessments code reviews with peers as needed experience managing your own tickets in assembla or similar code-management tools high-level experience with jquery (javascript library) high-level understanding/experience with restful api calls and ajax some experience with mongodb (nosql). even better if you have experience with familiarity with unix/linux basics experience with participating in daily scrums / bi-weekly retrospectives / bi-weekly kick-offs -knowledge and understanding of iterative development methodologies such as scrum and kanban experience working through cross-browser compatibility issues experience or familiarity withthings like branching and merging code strong problem solving skills you're passionate about ux "
11203,f,nann
5031,f,nann
15243,f,"qualifications 5 plus years pre-sales experience in the computer security and / or anti-malware space expert level knowledge of current security solutions and technologies. broad knowledge and understanding of the av industry and industry anti-malware offerings strong decision making skills with the ability to prioritize and execute in a methodical and disciplined manner. must be able to set and manage expectations with customers, stake-holders and team embers. exceptional written and oral communication skills. malware research, sans grem or other reverse engineering experience a bonus. requires the ability to work independently with substantial latitude for action and decision while maintaining focus on achieving optimal outcomes as part of a collaborative development "
16158,f,"the ideal candidates: requirements/qualifications/attributes minimum qualifications education: ba/bs preferred. a deep understanding of visual and user experience design best practices for web applications. experience turning complex problems into simple and engaging customer experiences. ability to use visual design to organize information and guide users through complex workflows. expert knowledge of user-centered design principles. experience creating visually stunning interactive user experiences for web. demonstrate comfort with an iterative and agile design process that includes managing feedback and constructive criticism. excellent collaboration skills with additional designers, product managers, and engineers. desired qualifications experience creating live style guides to be used cross-functionally. experience conducting user testing, interviews, and analysis. ability to create prototypes using modern front-end technologies and frameworks (html/css/js, grid systems, responsive design). basic knowledge of startup fundraising and financial markets. experience designing mobile applications. "
9905,f,nann
8755,f,you will need to have great customer service attitude team player school certificate and above clean morality certiciate excellent it skills 
6202,t,"develop and execute marketing programs to promote the company's brand. perform lead generation. attend trade shows. create advertisements, webcasts, websites, and direct mail. identify media outlets for press releases and promotions. enforce brand marketing guidelines in trademarks, logos, and publications. develop and track budgets. measure success of various marketing campaigns. drive profitable sales, brand growth and loyalty for a number of business areas. analyze and support both category and cluster marketing plans to align with brand strategy and achieve annual operating plan goals. develop accountability structure for stakeholders. develop and execute brand management plans. create and enhance agency and partner relationships. leverage customer insight data to refine brand management. identify brand-building areas. ensure brand communication for areas of responsibility are consistent with the company and brand positioning. develop and implement media planning, buying, and innovation strategies. provide design and direction for collateral, web, product packaging, and other visual communications media for the company. help promote uniformity and consistency of brand. "
11624,f,nann
15110,f,"your background: native proficiency of english language excellent writing skills and vocabulary curiosity about emerging trends in society, business and technology ability to summarize articles and texts to their very essence in an easy to read form time management skills experience with content management systems is a plus "
9614,f,"required skills include: high levels of personal energy, honesty, empathy and self-motivation good listening skills coupled with an ability to solve customer concerns to overcome purchasing objections ability to work within a structured environment that is goal oriented prior direct sales experience preferred, but not required "
6012,f,"we’re looking for all skill levels. if you are either: an excited, enthusiastic person with loads of potential, but not a lot of experience or an experienced professional who is still passionate about building amazing software and solving complex problems no matter where you are at in your career, send us a sample of some code you’re proud of. must haves: passion - you love the idea of making awesome, scalable software that delights users and you love to learn strategic thinking - everyone on our team influences our products and we’re all in this together proactive work ethic - we’re not big on bureaucracy; we hold each other accountable and push ourselves to perform tool agnosticism - if you have religious feelings about programming languages, we're not the company for you "
12398,f,"skill expertise: highly proficient with selenium testing frameworks. highly proficient at coding scripts for automation tasks. a strong understanding of test automation techniques using open source test tools such as selenium wd/cucumber/gherkin/soapui or bespoke tools. ability to design and implement automated frameworks for both online and api solutions and plan for the scalability and maintenance of any implementation. ability to work within, teach, and improve multiple software development lifecycle processes. knowledge and experience: able to provide evidence of successfully working at a senior level in software qa automation. experience of testing sports betting online applications preferable. coding experience with a very good understanding of either c++, c, java experience of working in both linux and windows environments is highly desirable. sql server experience desirable. attributes: outstanding interpersonal skills and the ability to establish positive relationships with employees at all levels of the business as well as external partners. resilient, approachable with the ability to work successfully in a dynamic, fast paced pan–european environment. ability to operate as a team player, with a flexible and positive attitude. always operates with the highest levels of honesty, integrity and fidelity, acting in the best interest of the business at all times. ability to work to tight deadlines, effectively prioritise and deliver to a high standard whilst under pressure. "
893,f,"requirements: bachelor’s degree or equivalent in business, economics, finance, law, i.t., marketing, accounting or equivalent. mba preferred. more than five years’ experience in the risk management related activities in the financial industry. good oral and written skills on a business level in both english and japanese. substantive and diverse knowledge of the parent company and other japanese financial organization’s business practices, products and procedures. suitable candidates please contact, gordon martin phone_9a0176b580d4836426eb45c6bbf707652f530638fb830058ac4f68888f113277 email_f4ebff1f11ff31df46f73791ed5de491f16a5c9134083790d3e181c904764a5f good managerial skills relating to employees, planning and policy formulation. substantive and diverse knowledge of securities-related legal, tax, regulatory compliance and/or accounting treatment good interpersonal skills (especially in interacting with japanese, u.s. customers and personnel, parent company, etc.) good communication and leadership skills "
10107,f,duties to include:- to assist in the day to day listing of products general shop duties. to control inventory and stock levels within the ebay network. /monitor pricing and evaluate moving prices in the market place to maximise sales. /also maximise the output of product and its awareness on ebay. this is a part time job and must be fixable with hours. please send you cv with cover letter.
98,t,"qualifications knowledge, skills abilities: a high school diploma or ged is required. must have a valid driver’s license. ability to read, write, and communicate effectively in english.good math skills.four years of experience as an ic technician and/or electrician in a power plant environment, preferably with a strong electrical background, up to and including, voltages to 15 kv to provide the following: demonstrated knowledge of electrical equipment, electronics, schematics, basics of chemistry and physics and controls and instrumentation. demonstrated knowledge of safe work practices associated with a power plant environment. demonstrated ability to calibrate ic systems and equipment, including analytic equipment. demonstrated ability to configure and operate various test instruments and equipment, as necessary, to troubleshoot and repair plant equipment including, but not limited to, distributed control systems, programmable logic controllers, motor control centers, transformers, generators, and continuous emissions monitor (cem) systems. demonstrated ability to work with others in a team environment. "
557,f,nann
6056,t,"we are seeking only honest, self-motivated people with a desire to work in the typing and data entry field the preferred applicants should be at least 18 years old with internet access. little experience is needed. minimum qualifications: • high school diploma or ged. • 1 year of clerical/data entry experience in a fast-paced environment. • demonstrate attention to detail with excellent data entry, communication (interpersonal, telephone) and organization skills. • ability to prioritize projects within a fast-paced, deadline-driven environment using tact and discretion. • basic database usage. • team player with good communication, data entry, organization and follow-through skills. • ability to write and type grammatically correct database entries in english. • intermediate microsoft word and excel skills. • experience using a corporate email system. • basic microsoft powerpoint. "
6404,f,"apply if you: have hands-on knowledge of:ruby on rails, haml/scss, jquery,sql and nosql are able tolead the projectindependetly have1,5+ years experiencewith ruby are passionate aboutsoftware development are able to show us yourcommunication skills love to take charge of the project you are dedicated to we will be happy to see: links to your blog (if you have one) and even happier if you: knowtdd, scrum and agilemethodologies have graphic skills salary: from 5000 zł netto (full time)"
2271,f,"you will... have a real passion for reaching the end user have a eye for detail, and a design portfolio that shows off your talents in the web and mobile space experience in wireframing and web and mobile application design and user interaction proven experience in web technologies such as html5, rest, css and javascript exposure to common web development frameworks such as foundation, bootstrap, and jquery be interested in learning new skills not be afraid to share ideas or ask for help enjoy participating in group discussions enjoy getting out there and testing our products! it would be cool if you also had... experience working in an agile environment "
4189,f,"expert knowledge of ruby, and rails experience of setting up, monitoring, and scaling infrastructure in the cloud (aws, rackspace etc) ability to integrate with 3rd party apis experience working with postgresql or similar demonstrable experience in developing applications for thousands of users you need to be able to work in our office in london, although we will consider remote work one or two days a week for the right person."
2522,f,nann
1662,t,"must be proficient with outlook some knowledge of quickbooks excellent customer service skills excellent grammar, spelling attention to details ability to prioritize "
15946,f,"position responsibilities: teaching safe patient handling methodology to existing hospital staff. performing and assisting with patient lifts and other patient handling maneuvers, as delegated by the supervisor in collaboration with the client staff. utilize patient handling equipment, transfer devices and protective equipment in compliance with hospital policies and patient handling protocols while utilizing proper lifting techniques, proper body mechanics and observation of hospital protocol. provide records of each lift to analyze key performance indicators. position requirements:please do not apply if you do not meet all of these requirements at time of application 6 months or more experience working with patients in a healthcare and/or ambulatory environment. customer service experience. minimum high school diploma or the equivalent. current cpr/ bls certified. experience with coaching/ training multiple individuals. flexibility to work day/ night/ weekend shifts including holidays. must be able to lift 35 pounds unassisted and to stand/walk for long periods of time. computer proficient to navigate both mainstream and proprietary software. be able to work independently and as part of a team. must pass a medical and drug screening before and during employment. preferred qualifications: ems / emt / paramedics / nursing / physical therapy military experience "
14208,f,nann
6080,f,"a flair for web-socializing and real-world experience in executing social media initiatives. knowledge of digital marketing current best practices and understanding of digital production processes. self-starter: this position requires a true self-starter who can assess a situation, develop a plan, get approval and run with it. "
4144,f,"practical knowledge experience: strong research, analytical and problem solving skills ability to write/debug administrative and reporting tools in one of the the followingprogramming languages: perl/shell or python, desired; java, c/c++, ruby solid understanding of a linux/unix-based operating system nderstands paging and swapping, inter-process communication,filesystem concepts (inode, clustering, logicalpartitions) experience with host security (e.g., passwords, uids/gids, sids, filepermissions, acls, filesystem integrity, use of security packages) knowledge of palantir or any siem product knowledge of e-mail – sendmail and/or postfix experience with any of the following systems management and monitoring :empire sysedge/snmp, nagios or similar experience with mit kerberos, rsa securid, radius, spnego knowledge of ria technologies such as flex, silverlight, extjs, gwt penetration testing tools like tenable nessus, qualys, skipfish, flawfinder,swift bigdata: hadoop, elasticsearch/solr xml/rest/soap "
5229,f,"education:bachelor’sdegree in a finance, accounting, or engineering required; post-graduatedegree in business (mba) preferred. knowledge and skills: strong financialmodeling skills in excel, ability to extensively communicate, previoushand-on experience building, managing and updating a financial model, and abilityto provide summary data to the most relevant points. experience withexploration and production (ep) companies, portfolio management orinvestment banking preferred. strongpresentation skills and ability to articulate and defend a position. ability to workdirectly with executive management with short time tables and very highexpectations. high degree ofattention to detail. experience:3+ years recentexperience with valuation and financial modeling required. industry, location and compensation industry:oil gas – investor relations location:oklahoma city, ok compensation:commensurate with experience."
9590,f,"bachelor's degree in computer science, information systems or tech related. 1+ years experience in an operations related role. such as technical operations, tech-related supply chain management, software project manager, technical administrator, it operations 1+ years experience in internet, software or mobile industry fluent in google docs, expert in internet research (google search, quora, stackoverflow). fluent in english extremely organized and very attentive to details ability to prioritize, multi-task can do attitude "
6087,t,"minimum requirements: hs diploma0-2 years of related consulting experience preferred qualifications: minor repairs and troubleshooting of systems to maintain proper operationfamiliarity with electrical systems (motor starters, relays, fuses, switches, etc) strongly preferredability to work with minimal supervisionability to travel as needed to the field requiredability to interact effectively with internal and external clients"
641,f,"you'll have strong written communication skills and a good eye for detail, be logically minded and able to understand new systems, software and processes quickly. the role will require you to gather, organise and quality check product information for large numbers of products whilst delivering short, informative copy. a natural organiser, you'll have a solid work ethic, be self-motivated, and able to excel in a fast paced environment. technically you'll be proficient in ms office (particularly excel) and have a basic understanding of html and content management systems. experience in an ecommerce environment (or with products for the home and garden) would be an advantage. this is an opportunity with real prospects for professional growth in the world of ecommerce. this is not the role for you if you want a career in journalism."
6767,f,"bs in computer science or equivalent degree required 7-8+ years of software development experience with emphasis on user-oriented development expertise in flash-based technologies with 4+ years of flex sdk 3 and/or flex sdk 4 and actionscript programming experience. 5+ experience with java/j2ee, spring 3.x, spring/blazeds is a must. experience with flex builder 4. in depth knowledge of software engineering and object-oriented programming principles. experience with design patterns and refactoring. experience with xml and xml-related apis familiarity and past work experience with design specification methodologies (use cases, uml) hands-on experience with web applications. exposure to test driven development and unit testing is helpful experience with open source web technologies such as ant, maven and jenkins"
12499,f,"requirements a proven track record of initiating and delivering actionable analysis with minimal supervision a maniacal focus on identifying and tracking key financial metrics across the business ba or bs/ms degree with strong academic record, preferably in a quantitative discipline minimum of 1-2 years experience in a quantitative, finance role with experience forecasting financial statements excellent communication skills, including experience in high-level business discussions unbeatable excel skills strong skills querying sql databases familiarity with common saas metrics (mrr, arr, churn, cac, ltv, etc) "
7075,f,requirements: five years collection experience with at least 2 years in a leadership role college degree preferred strong references from inside and outside industry strong knowledge of compliance/collection regulations understanding of automated dialer 
1606,f,"minimum requirements: minimum of 1 year customer service related experience required high school diploma or equivalent (ged) required preferred qualifications: keyboarding and windows environment pc skills required (word, excel and powerpoint preferred) experience running mail posting equipment a plus excellent communication skills both verbal and written lifting up to 55 lbs with or without accommodations willingness and availability to work additional hours if assigned ability to effectively work individually or in a team environment competency in performing multiple functional tasks ability to meet employer's attendance policy "
14540,f,"2+ years , framework 3.5 and up 1+ years microsoft mvc 3/4/5 strong knowledge of sql ability to work with html, css, and javascript ability to clearly articulate design ideas and share feedback php, ios or android a plus "
17584,t,no any experience required.
1254,f,"degree in computer science, engineering or a related subject have published one or more ios apps in the app store a deep familiarity with objective-c and php experience with third-party libraries and apis working knowledge of the general mobile landscape, architectures, trends, and emerging technologies solid understanding of the full mobile development life cycle "
17556,t,nann
9766,f,nann
10392,f,"high school diploma or equivalent education must be at least 19 years old and have a minimum of two years of driving experience valid and current driver's license valid and current proof of insurance ability to comply with any specialized regulatory or licensing requirements, as determined by geographic location and/or work assignment must attain satisfactory completion of specialized training regarding transportation of goods with special handling requirements including, but not limited to, dry ice, clinical samples and/or medical products must be able to utilizean ios in quick and efficient manner for new hires, must meet all shipster employment qualifications at time of hiring, including successful passing of background check "
