,fraudulent,requirements
14737,f,"requirements experience: 10+ years of experience in embedded software development using object-oriented design principles and modern operating systems such as linux experience with the design of real-time and mission critical communication products is required. 5+ years of management and supervision of a software development team in a complex multi-location environment 5+ years of hands on experience in iterative software development, continuous integration, and test driven development 2+ years of experience with networking centric products such as gateways and routers. experience with cellular wireless, wifi and gps is highly desired. a leader with excellent people collaboration skills is required self-starter with excellent verbal and written communications skills above all, strong design skills are required in not only embedded software but also a system level understanding that includes the hardware domain and the practical application of communication products to real world problems. educational qualifications: hold a degree in electrical computer engineering or computer science or a technology diploma with relevant industry experience we provide full time permanent positions for many medium to large us companies. we have more than 1500 jobs available in our website. our website has thousands of openings and these job openings are not posted anywhere else online. when you apply online through our website, it automatically forwards your information to the recruiter handling your applied job. if you are a close match, they will contact you immediately to discuss about the positions and do everything to get you an interview with the client as quickly as possible. visit : "
16916,f,"education qualification: bachelor’s degree in accounting or finance preferred peachtree expert at excel experience managing a department proactive in identifying issues and implementing innovative solutions strong analytical, communication, and delegation skills strong decision-making skills...ability to use sound judgment and challenge assumptions when appropriate demonstrated ability to manage multiple deliverables at one time. "
2369,f,"position requirements: we are looking for a person that has: 3-5+ years of experience with database development in sql server (understanding of, and experience with database structures, theories, principles, and standard sql practices) design/implement/optimize sql code, queries, indexes, stored procedures, views, functions related to our saas application experience with entity framework methodology and visual studio tools to provide additional support to application development teams performance tuning and optimization (pto), using native monitoring and troubleshooting tools. backups, restores and recovery models. troubleshooting and resolving database problems implementing operational automation using scripts and/or maintenance plans working with windows server, including active directory and proper disk configurations. knowledge of high availability (ha) and disaster recovery (dr) options for mssql server. good communication and documentation skills. job responsibilities will include: design/implement/optimize sql code, queries, indexes, stored procedures, views, functions related to our saas application develop data migration procedures and policy work with architecture, application development and support to achieve a reliable, top performing environment that meets current and future business objectives train and develop technical support staff to better utilize database environment endure that the code is written keeping in mind any security issues such as sql injection develop reports in sql server reporting services creating sql applications to facilitate current and future business objectives company description: bigtime®software, inc. develops cloud-based productivity tools for growing professional services firms and licensed oem partners. the highly customizable, browser-based interface for practice management allows professional services firms to instantly deploy and connectbigtime® to existing back-office services. oem partners licensebigtimetechnology as the critical component of their accounting and productivity an intuit gold certified developer and a member of the microsoft partner network. founded in 2002, the company is venture capital backed with thousands of users in the united states, canada, uk and australia. for more information, please visiturl_41396fd282d531030b86473eea48af14202751bd12542ed9d7eda952254ddce4."
2713,f,"requirements and must-have skills:high education in it-related specialtiesfluent english (professional level)good experience in at least one of java or ruby and some experience of bothtdd / bdd (experienced)agile way of workingexperience in working in linux / solaris environments nice-to-have skills, in order of priority:build and dependency management tools (e.g. gradle / groovy, maven)git and git repository management solutions (e.g. github/gitlab, atlassian stash)experience with clearcase migrations to other scm systems, preferable git."
7885,f,"education: bachelor’s in business administration, human resources, accounting, or related field experience: 5+ years of experience in a benefits analyst or leadship role, with experience supervising and leading a team strong analytical skills and a thorough knowledge of health and welfare and retirement plan designs and administration ability to manage several complex projects simultaneously while working under pressure to meet deadlines knowledge of all pertinent federal and state regulations and filing and compliance requirements affecting employee benefit programs including erisa, cobra, fmla, ada, section 125, workers compensation, medicare and social security, and dol proven ability to work effectively in a team environment excellent written and verbal communication and organizational skills proficiency with the microsoft office suite (word, excel, powerpoint, and access) "
10590,f,you are the one if: you speak and teach english like a boss you can teach one-on-one as well as in class you find projects and things to do on your own you are experienced with and enthusiastic about online teaching techniques we have tons of fun in your company 
17583,t,must be able to work from home
3598,f,"experience in hair cuts, color, ipods, and more"
9887,f,"qualifications: university degree in computer science, computer engineering or relevant field. excellent knowledge of english at least 1 year of experience in software development thorough understanding and exposure in the it industry, collaborations and decision-making processes master’s degree in relevant field would be considered as an asset skills required: fluent in established software architectures/development systems depth knowledge of object oriented programming knowledge experience in database design and implementation for rdbms systems (at least microsoft sql server) knowledge of constructs, syntax and subtleties of c, java languages ms visual studio environment high level of creativity with the ability to solve complex technical problems solid administration and troubleshooting skills excellent written, verbal and presentation skills excellent interpersonal, communications and organizational skills excellent prioritization skills (efficient time management) to meet deadlines "
12592,f,"ideally you: - have a keen interest in the field of hr - must be proactive - are committed to an internship - understand the importance of confidentiality - are tech savvy, you love technology, new apps and ideally have knowledge of google applications - are good at online research - are studying at degree or masters level towards business administration or hr(but not essential) - an interest in e-commerce is desirable."
825,t,"general qualifications: excellent communication skills is required. must have a desire to learn, work in a team environment, a and have a winning attitude. experience required: project control professional 10+ years experience project control specialist 5 to 10 years experience project control tech 1 to 10 years experience software experience: - ms project, required primavera 6 a plus, but not required microsoft office excel ms word experience preferred: project controls experience for small to large projects from conception, through construction, to closeout. required education: high school diploma rquired, with an accounting or business degree preferred. "
6323,f,"highly desirable: 1. experience with using fiddler and integrating to visual studio test components 2. experience using tfs source control 3. experience in test automation against 3270 or other terminal emulators 4. experience with client side testing using windows presentation foundation (wpf), model-view –controller (mvc) or model-view-viewmodel (mvvm) 5. cs/ee or related field degree skills experience experience with any combination of the following items: 2. highly effective communication skills and ability to work with technical and non-technical colleagues and business customers. 3. ability to work independently and within a team to research and validate innovative solutions to challenging business/technical problems 4. knowledge and experience in automation and performance testing frameworks 5. experience in functional and performance automation with visual studio test tools 6. software test design and development skills experience using coded ui tests, web performance tests, etc. 7. experience in using team foundation server (tfs) and solution development lifecycles (sdlc) and workflows 8. testing mainframe applications 9. experience using and integrating fiddler test scenarios into visual studio 10. understanding and knowledge of testing web applications or network protocols 11. performance testing dealing with data mining 12. iis or sql "
7424,t,qualifications personal attributes onc in mechanical engineering.city guilds or equivalent qualifications in mechanical or hydraulic disciplinedemonstrable experience relevant to the position.
17575,t,nann
2009,t,"desired skills experience 10+ years experience in a software quality/testing role, with 3+ years as an architect/hands-on manager deep expertise testing web-based, enterprise software powered by data and complex analytics high comfort working with selenium, jmeter, java, and ant (or other scripting languages) strong knowledge of relational databases (sql or similar) and exposure to non-relational technologies operational understanding of statistical concepts and applications "
14270,t,nann
8140,f,"qualifications include strong communication skills able to use or learn scheduling software experience microsoft word, excel and other software applications organized and detail oriented able to follow instructions and work with little or no supervision knowledgeable of caregiver's duties able to pass all pre-employment background screen "
1181,f,"- career in marketing with +3 years in experience - proven experience in graphic design communication - proven experience in campaigns product launch - proven experience managing vendors, budget people - technological saviness (apps, smartphones,computer skills) - desireable experience in startups or as entrepreneur - goal oriented, self-driven, works well under pressure. - strategic thinker networker - fluent in english"
8895,f,nann
17614,t,nann
1217,t,insurance license. car 
7393,f,nann
6877,t,qualifications personal attributes hnc in electronic or electrical engineering.city guilds or equivalent qualifications in electrical or electronic disciplinehave completed a recognised apprenticeship in an appropriate discipline
7953,f,"requirements bachelor’s degree in computer science, business, engineering or related preferred 3+ years experience in a technology related field, managing high-profile customers advanced knowledge of advertising exchanges, mobile platforms, online advertising technology and systems ability to prepare and present technical material to peers, clients and non-technical audiences in an efficient and cohesive manner a passion for high-growth, early stage companies and a clear understanding of how to operate in such organisations ability to multi-task with tight internal and external deadlines strong organisational, analytical, and time management skills a team player, a self-starter, and a passion to succeed excellent written and verbal communication skills french, german, italian language skills is a plus "
8918,f,"required skills relevant university or college degree (statistics, finance or accounting). excellent command of english, both written and oral. excellent use of ms excel (using advance formulas, visual basic, etc). experience with reporting tools such as qlikview and any other reporting tool will be considered a plus. focus on details and information accuracy. strong organizational skills; result-oriented and ability to set priorities. desire for continuous learning and skills improvement. excellent team spirit, written and oral communication skills. very good time management and multi tasking skills. ability to travel. desired skills experience within travel industry will be considered an asset. experience in online marketing will be considered an asset. excellent level of english. "
13144,f,nann
17553,t,5+ years working incustomer service -microsoft office and general computer use -accounting program knowledge required -mrp system knowledge a plus -experience with quick books a plus -proficient in german language. other languageproficiencyalso beneficial.
1198,f,nann
3515,f,"minimum of bachelor’s required. technology, game development/design background preferred english fluency is a must. cantonese and mandarin are a plus solid understanding of the game development process at least 2 years of supply/workflow management experience is a must responsibilities: oversee the entire production process of multiple projects simultaneously coordinate placement of talent based on budget and resources while maximizing efficiency understand company’s goals and direction for each project and provide guidance throughout game production from concept through to post-launch foster a creative environment and motivate team to bring their a-game on a daily basis what you will do: build and drive sustainable production processes to manage multiple game product lines ensuring high priority tasks are pushed and release dates/events are met maintain timelines and milestones for games in the active pipeline through the development process from concept to post-launch work cross-functionally with departments to establish performance indicators and optimize processes based on past performance and future needs present monthly update reports to chairman on performance and status of existing pipeline "
17604,t,"education / erxperience: bachelor's degree in mechanical, civil, naval architecture or ocean engineering. master's degree preferred.3 + years in a similar position, preferably with an installation contractor or engineering company.good oral and written communication skills.knowledge of offshore installation techniques and equipment.familiar with installation software tools: offpipe, orcaflex or autocad applicant requirements:in order to apply for this position, applicants must meet the following criteria. if your resume does not match these criteria, you will not be able to apply for this position."
13420,f,nann
8503,f,"passion and eagerness to work collaboratively on tasks big and small. you display exceptional organizational and communication skills, enjoy fast-paced, often unpredictable environments, thrive on interpersonal interactions, love working in teams, and are able to multi-task and manage projects effectively. experience in a high-impact, sales role in a growing business environment. knowledge and experience working in a regulated tech industry. track record of achieving results in a corporate environment with success in building funnels, and tools to support a tight-knit sales team. exceptionally strong sales skills, with an ability to clearly communicate your products and close sales. excellent quantitative skills and a proven ability to analyze performance management strong proficiency in every aspect of the sales process; demonstrated ability to specify new markets and demonstrate strategic decision-making and use sales indicators to manage organizational performance. strong organizational skills and attention to detail, with a demonstrated ability to work independently, lead multiple projects, ruthlessly prioritize, and manage a high-volume of tasks, deadlines, requirements, and decisions. preferred qualifications: 5+ years experience in a managerial position within a sales environment enterprise level software sales experience. solid understanding of both long and short sales cycles. post secondary education "
13176,f,"master’s degree required in relevant technical area minimum 10 years of technical and project / program management experience, preferably in a usaf or dod environment extensive experience formulating and managing project budgets, implementing schedule tracking, risk avoidance and mitigation direct experience / knowledge of usaf policy, projects, and customers demonstrated experience in business development, proposal development, and project / program management ability to work independently and collaborate with others proven ability to identify and create business expansion, market / sector development, and strategic alliances current clearance to the secret, top secret, or ts/sci level. "
5709,f,"a portfolio of published android applications demonstating experience. excellent communication skills through code and documentation, prototyping, and high level concepts. exceptional coding skills and computer science fundamentals. bsc in computer science or equivalent.3-5 years of software engineering experience. strong attention to user experience, including the customisation of user interface components. programming paradigms such as oop / mvc, code reviews, agile, test driven development. "
9072,f,"requiredknowledge, skills and experience: high school diploma required, some college education in sustainability or related field preferred minimum of six months office/clerical related work experience preferably related to sustainability display high level of professionalism proven track record of maintaining performance level in a high volume environment strong team player with excellent interpersonal skills self-motivated performer with a history of effectively utilizing internal and external resources working knowledge of using microsoft outlook required advanced conference room booking experience via outlook required must have working knowledge in presentation (powerpoint) and spreadsheet (excel) software working knowledge using microsoft windows required keyboarding and windows environment pc skills excellent verbal and written communication skills ability to effectively work individually or within a team in a fast paced environment competency in performing multiple functional tasks ability to meet employer's attendance policy willingness to learn new software systems / online tools willingness to cross-train for other job functions ability to perform the following duties with or without an accommodation: lift up to 40 lbs occasionally sit, stand, and/or walk for long periods of time travel (e.g. walking, taking a shuttle, etc.) from building to building on the client's campus bend, reach, squat, and perform the necessary receptionist job function "
5515,f,"prn patient care provided on a per visit basis (~10-12 visits/week). work with administrative and supervisory personnel regarding therapy visits to assure high quality and proper follow-up patient care. participate in case conferences to ensure optimum communication within and between departments and to discuss active issues. report all events that vary from policies and procedures and/or standards of therapy care to the therapy supervisor. follow physician orders for treatment job requirements active ot license in the state of ca. current cpr, tb, work clearance physical, driver’s license and auto insurance. reliable transportation and comfortable providing service in the home environment. excellent physical assessment and critical thinking skills. excellent written and verbal communication skills"
4127,f,"this is not your normal job and you probably wont be a normal candidate, you'll be smart with a positive attidue and desire to help customers above all else. sure, you will be closing sales at the same time but this isn't glengarry glenross or the boiler room - you'll be helping companies succeed by helping them with one of their biggest challenges, recruitment. you must be: tech-savvy, meaning that you are comfortable using modern office productivity tools, you are an efficient user of spreadsheet software and you can understand/learn our product well enough to be able to sell it to others. you will be doing software demos and explaining software features to users all the time. pleasant and patient communicator. we pride ourselves for our exceptionally friendly customer support, we communicate with respect and timeliness and we guide our users with patience and dedication. self-motivated, a drive to carve out a career with a fast-growth tech startup you must have: the ability to turn technical language into plain english that everyone can understand. not all our customers are 'online natives', we have customers from a broad spectrum of industries and backgrounds. bonus points if you qualify for one or more of the following: college education in science, engineering or human resource management experience working for a software company or technology startup experience in sales, presales, inside sales or outbound lead generation experience in online customer support and customer relationship management experience in the field of recruiting or hr "
10415,f,"position : senior sas application support engineerjob location : united states-virginia-reston us work status required : ead / green card / us citizens detailed bounty descriptionthis application support, senior will work within the enterprise tools team and will perform as a sas administrator to install, configure and support sas environments. this group supports over 800 internal customers and approximately 200 applications.responsibilities include:• plan, coordinate and implement product upgrades and perform maintenance activities, troubleshoot system related problems and is responsible for the overall availability of the tools infrastructure and the environment.• troubleshoot sas infrastructure issues and implement required changes following the change management processes.• provide input and interface with platform teams, report developers, testers and end users. • 7+ years of experience in sas 9 implementation, installation, architecture design and administration.• 3+ years of experience working on supporting multiple medium to large size projects preferred • college degree or equivalent experience• experience with apache/tomcat• experience with java and linux shell scripting preferred• strong troubleshooting techniques for basic and advanced infrastructure issues.• strong relational database and sql experience• strong verbal and written communication skills• must be able to work effectively in a team environment• unix, linix and solaris administration experience.• experience with san and nfs file systems.• experience with trouble ticketing systems."
2301,f,"native or bilingual english speaker with excellent verbal and written communications skills tech-savvy, meaning that you are comfortable using modern office productivity tools, you are an efficient user of web apps and you can understand/learn our product well enough to be able to sell it to others. you will be doing software demos and explaining software features to users all the time. flexible to adjust to other time zones. our customers are all over the world, so you will often need to schedule demos and respond to calls or emails in the late evening hours, sometimes even late at night. of course there will be flexibility on our side, but please understand that this will not be a 9-to-5 job. strong listening and presentation skills ability to multi-task, prioritize, and manage time effectively nice-to-have extras: experience working for a software company or technology startup experience in sales, presales, inside sales or outbound lead generation experience in online customer support, including customer relationship management with social media experience in the fields of radio, television or music production university degree "
9511,t,qualifications personal attributes • relevant qc inspection experience - essential• hnc or equivalent in mechanical engineering - desirable• trade qualification in mechanical engineering - desireable
9277,f,"3-5 years’ experience in facilities management and/or administrative positions full proficiency in microsoft office suite ability to work on a small team in a fast-paced, high-demand environment "
1456,f,nann
7118,f,"you will have an excellent understanding of the engineering product lifecycle along with strong knowledge of the production and supply chain functions. with your demonstrated experience working with or alongside a repair or support service centre, you will also have strong commercial nous and the ability to make sound decisions in an ever changing and fast paced environment. if you have all of this and experience in maintaining industrial products with a high need for reliability, then we want to talk to you! it goes without saying that you have very good organisational and administrative skills and have exceptional communication skills – verbal and written. n.b you must have no restrictions to international travel."
