,fraudulent,requirements
13348,f,"a medical centre in a prime location at the centre of the gold coast is seeking a gp!the practiceyou will work alongside 2 other gps and be supported 3 receptionists, a nurse and a practice manager. allied health services such as a dietician, an occupational therapist, pathology, ipl skin clinic, a speech pathologist, massage therapist, exercise physiologist and a psychologist are available on site.surgery opening hours are monday to friday 8am - 6pm and saturday 8am - 12pm.work hours are negotiable.the fully computerised practice is currently bulk-billing patients but can accommodate mixed-billing according to the doctor's preference. the clinic is located in air-conditioned, modern premises that feature 3 consulting rooms. a large shopping centre is located across the road.the practice has an excellent team environment and is very family orientated.theme parks dreamworld, movie world, wet and wild and australian outback show are a short drive away!the locationmention the gold coast and various images come to mind... stunning beaches, a surfing paradise, exciting theme parks, sun-kissed locals, sophisticated style, the list goes on. explore the hinterland or go on safari. the gold coast truly offers something for everyone. sun, surf, sand and vibrant city sights greet the eager gold coast holiday-maker. australia's no.1 tourist destination offers breath-taking rainforest retreats, luxurious beaches and a world of fun and adventure for the whole family.with over 10 years experience in the medical recruitment business, ramberg associates will ensure that your application process is dealt with in a timely manner, adhering to the highest ethical and professional standards.contact us on +61 2 80363182for more details or apply to email_3b7c2f21696ed05b97cfa4bf5014dedd2188794a2e807b6943cad1a6b810cf92"
6974,t,"skills/knowledge: ability to communicate well with internal and external customers in a professional mannerexhibit outstanding influencing skills to effectively drive project / program effortsdemonstrate a proven track record of excellent project management, bringing the ability to quickly put structure in place to manage work in a dynamic complex environment.display a passion for coaching and developing a team of associates through their leadership stylehave excellent communication and partnership skills which are essential for interacting and communicating with key stakeholders at all levels across the company to manage, inform and influence outcomeseducation: bachelors degree in engineering; advanced engineering degree preferredminimum 3 years of project management experienceminimum 1 year of people management experienceexperience: technical/industry expertise- demonstrated background in engineering (preferably within the oil gas drilling industry);10 years technical experience with at least 5 years managing an engineering design organizationpreferred qualifications: masters / mba degree:at least 5 years of project management experienceat least 3 years of people management experiencepmp, lean, agile or six sigma certificationexceptional communication and collaboration skillsexcellent problem solving and influencing skills applicant requirements:in order to apply for this position, applicants must meet the following criteria. if your resume does not match these criteria, you will not be able to apply for this position."
7364,f,"your skills: university degree with minimum 6 years of experience in it or non-university degree with minimum 12 years experience in it; minimum 4 years experience in it service management. practical experience with itil implementation and service level management is mandatory; minimum 1 year of experience in usage of project management tools and in quality procedures; hands on experience in developing and maintaining ict projects; experience in data migration and business analysis; extensive experience in technical document writing; professional experience with erp and communication applications is considered an asset; excellent command of english, both written and oral. "
10521,f,nann
2652,t,"* ability to multi-task* ability to perform and prioritize multiple projects simultaneously* ability to work independently with little supervision* thorough knowledge and proficiency with microsoft office ; primarily powerpoint, excel, andword * strong written and verbal communication skills; excellent attention to detail and strong planning abilities"
17729,t,"you will be working alongside of the producers and writers, helping and developing shows to put onto the programming for the network, you are required to have a high school diploma, preferabbly a bachelors degree, at least one year of experience."
1061,f,"5+ years working as a quality assurance engineer testing web and desktop applications 3+ years as python backend developer expert in manual and automatedmulti-platformfrontend testing expert in automated multi-platform backend testing of python software work experience with continuous integration and issue trackers work experience in ensuring security standards and testings work experience with tests for multiple os, database systems, apis enterprise setups work experience in problem isolation, writing test plans or test matrices and debugging love for digging deep into issues until the root cause is found an eye for odd frontend behaviour in terms of ui and ux strong analytical thinker who can work independently excellentcommunication and interpersonal skills excellent spoken written english "
1935,t,"qualifications personal attributes: degree or hnc/hnd with relevant industry experience in an electrical or electronic background. experience within a design environment, preferably within the oil and gas subsea controls industry preferably chartered engineer status strong electrical background/experience preferrably with computer-controlled industrial control systems. knowledge of networking and an understanding of communication protocols: rs232, rs485, rs422, modbus rtu and tcp/ip etc. knowledge of windows based control systems understanding/experience in working with iso 9001 operating procedures able to demonstrate a logical approach to system design and appreciation of system processes, procedures, and requirements. must posses strong communication and presentation skills both written and oral and posses the ability to discuss and conclude technical discussions effectively at all levels familiar with participation in fmea, fmeca risk analysis activities we offer: • friendly colleagues in an industry with a bright future.• an environment where you are encouraged to develop your skills and share your knowledge with your colleagues.• competitive benefits and strong focus on work-life balance.if you would like to join us on our journey, take a position with aker solutions, the preferred partner."
14877,f,1) degree or certification in accounting or bookkeeping or minimum 3 years’ experience in accounting/bookkeeping 2) experience with integrated accounting software 3) experience with third party payroll software 4) proficient in microsoft office (word and excel)
8494,f,nann
3042,f,"minimum of six years mechanical design experience that includes fouryears electromechanical project design and responsibility expertise in fea (focus on vibration stress) cfd (thermal). packaging of electronic assemblies sheet metal injection molding desgin 3dcad (autocad, solidworks, etc.) "
8838,t,"dedicated people who enjoy helping others high school diploma, ged or higher 6 months to 1 year of customer service experience in a service related industry preferred (contact call center, retail, food service, telecommunications, etc.) computer proficiency, including web navigation strong communicationskills adaptable to changing situations you must be at least 18 years old to apply and pass drug screen, criminal background check, and comprehensive assessments during and after training. novation is an equal opportunity employer. "
1559,f,"basic qualifications: •four (4)-year degree in computer science, computer engineering, business, or other applicable field. •2-4 years of relevant it audit experience •demonstrated functional audit knowledge and ability to apply auditing protocols. •advanced knowledge in relevant information technology field such as active directory, windows/unix, databases (oracle, sql, db2), application development/system development life cycle, network security, nerc cip, peoplesoft or maximo. -change control knowledge •ability to communicate clearly, concisely, and accurately using oral and written communications with various levels of management. •ability to reason logically, analyze data presented, evaluate the impact of information collected, and draw appropriate conclusions. •ability to develop and maintain good working relationships with internal and external customers. desired qualifications : -big 4 experience •holds or is working towards a certified information systems auditor, certified information systems security professional, certified internal auditor, project management professional or other professional certification. • an understanding of system development life cycle • advanced degree, such as an mba."
9704,f,nann
812,t,job site set-up. loading and unloading of equipment. pressurize system. locate any potential problems that may occur with testing. (prior) install bravo retrofit fittings. install underground piping. fill sumps for testing. pump out sump after testing. must have or be able to obtain manufacturers certifications. keep jobsite clean at all times. 
4967,t,"requirements 2+ years of inside sales experience track record of over-achieving quota strong phone presence and experience dialing dozens of calls per day proficient with corporate productivity and web presentation tools experience working with or similar crm excellent verbal and written communications skills strong listening and presentation skills ability to multi-task, prioritize, and manage time effectively ba/bs degree or equivalent "
5688,t,"qualifications high school diploma/ged required, college experience preferred must have at least two years experience in call center environment, outbound calling preferred. excellent communication skills "
7103,f,"at least 18 years old. high school diploma or ged. must pass a physical with a lifting test of 75lbs, drug screen, reference check, and criminal history background check. experience in mental health or developmental disability field preferred but not required. "
17188,f,16-18 year olds only due to government funding. full time availability.
17249,f,nann
17786,t,"experience in running a busy officeexceptional organisational skillsexcellent communication skillsstrong attention to detailthe ability to work under pressuredemonstrate initiativeproblem solving skillsbe able to work as part of a team this will be a great role for an intelligent, ambitious and motivated person who enjoys a challenge. due to our fast paced work environment we will only consider applicants that have the above mentioned skills and experience as a minimum. we will only contact applicants that we have shortlisted for an interview."
15264,t,no experience required and never any fees.
9270,f,"what are we looking for: as the next happiness hero, you will be working here in our singapore office alongside our awesome team of 16. ps. we're moving to a new office smack in the center of cbd you'll love it! you know how to use tradegecko, and you love anything software and app. you want to make a difference in the team and is an amazing team player. you are a happy, positive-minded, kind person who loves talking to others and getting connected. you have a great eye for detail and is able to think on your feet when dealing with customers. "
5274,f,nann
2866,f,"must have: 3+ years of experience in a relevant field (communications, content, pr, copywriting or marketing) passion for incrediblue and our mission ability to execute at both strategic and hands-on levels. excellent copywriting communication skills proﬁcient in english (both verbal written) experience in leading and managing similar campaigns experience in using email marketing tools like mailchimp, etc. bonus skills: boating/sailing skills and experience experience in optimizing landing pages and user funnels experience in using task project management tools like trello, asana, etc. experience in using design collaboration tools like invision, etc. other european languages "
937,t,"responsibilities: duties and responsibilities: makes recommendations and implements programs for handling environmental issues in full compliance with applicable regulations. application of iso 14000 environmental management systems. produces written documents with clearly organized thoughts using proper sentence construction, punctuation, and grammar. enter data or information into a computerized maintenance management system. work safely and communicate a commitment to work safely to others. be the environmental champion and liaison with: personnel contractors consultants regulatory agency representatives manages the environmental compliance action plan. ensures environmental records management process meets agency requirements and uses resources effectively. regularly performs process hazard analysis and participates in investigations. manages projects and timely communicates problems and achievements. meets regularly with employees and contractors. oversees and performs environmental inspections, audits, and sampling. ensures appropriate environmental training is completed. assists in completing and submitting agency submissions. assists in the review and reporting of the impact of environmental regulatory change on the business. demonstrates focus on continuous improvement and environmental sustainability systems. participates in the hes committee. qualifications: minimum education, knowledge experience: bachelor’s degree in environmental science, environmental engineering, environmental planning, or a related field (biology, geology, hydrology, chemistry, natural resources, etc.). another degree may be acceptable with experience in environmental compliance. minimum of three plus (3+) years of professional level experience in the field of environmental compliance is required. demonstrable experience in the application of environmental laws/regulations. experience with the following agencies and programs is highly desirable: sjvacd, carb, blm, doggr, epa. hazardous and non-hazardous waste, air permitting and testing (title v), wastewater disposal, spill response (spcc), biological surveys, and resource management. has or is working toward an environmental certification listed by nrep is highly desirable. knowledge and prior use of microsoft office programs including intermediate knowledge of microsoft excel, power point, and word. microsoft sharepoint experience is a plus. "
5415,f,"the successful candidate will have a valid drivers license with the ability to drive standard. having a forklift license is also a plus. they will also be able to lift 50 to 60 lbs. available for work 5 days a week and possibly some weekends. speaks, understands, writes english. familiar with streets in gta."
215,t,"qualifications knowledge, skills abilities: a high school diploma or ged is required. must have a valid driver’s license. ability to read, write, and communicate effectively in english.good math skills.four years of experience as an ic technician and/or electrician in a power plant environment, preferably with a strong electrical background, up to and including, voltages to 15 kv to provide the following: demonstrated knowledge of electrical equipment, electronics, schematics, basics of chemistry and physics and controls and instrumentation. demonstrated knowledge of safe work practices associated with a power plant environment. demonstrated ability to calibrate ic systems and equipment, including analytic equipment. demonstrated ability to configure and operate various test instruments and equipment, as necessary, to troubleshoot and repair plant equipment including, but not limited to, distributed control systems, programmable logic controllers, motor control centers, transformers, generators, and continuous emissions monitor (cem) systems. demonstrated ability to work with others in a team environment. "
2991,f,high school diploma or general education degree (ged) excellent written and verbal communication skills strong attention to detail and organization ability to prioritize and meet deadlines internet/emailing knowledge prior retention or sales experience(a plus but not required) excellent customer service and negotiation skills 
12308,f,nann
6829,f,"we are looking for an individual whois a: dedicated outbound caller to customers manages own workload according to performance targets thrivestalking to prospects over the phone hungry for success previous experience of building rapport easily over the phone successful track record of selling products in an outbound environment happy to work evenings/saturdays the successful applicant will have excellent communication and listening skills, enjoys working with customers and building relationships, has a postive attitude and will be well organised and thorough, even under pressure."
8606,f,"duties and responsibilities execute pricing proposals accurately and on-time using pwb input and market / customer knowledge. prepare pricing data to be included in the sni written responses to customers8217; formal requests for proposal, and respond to on-line bid opportunities as required. be a logistics and transportation industry consultant to client managers, capable of articulating market changes and schneider8217;s needs. collaborate with other regional pricing teams to ensure solutions are optimal for entire network. improve both outbound and 8220;tour8221; prices. prepare price increase analysis to improve geographic profitability and then support client managers8217; efforts to improve the profitability of their book of business. analyze pricing results and account/lane/geographic profitability. make recommendations for improvement. participate in super guideline reviews mentor new associates. participate in market reviews. experience and skill requirements minimum of two years work experience or bachelor8217;s degree required. high attention to detail effective written communication skills. strong analytical skills along with excellent problem identification and resolution skills required; high attention to detail. strong organization skills with the ability to prioritize and plan out a day. positive attitude and the ability to be a team player. timely and accurate follow-up with internal and external customers. highly motivated self-starter. a demonstrated willingness and ability to hold themselves and their peers accountable for results. "
14004,f,3+ years of selling experience into corporate sector a proven track record of negotiating and closing enterprise deals or other crm experience passion and commitment to spread product/process innovation solutions within large enterprises experience in negotiation and deal structuring can adapt to a rapidly-changing environment willingness to learn the lean startup methodology 
2935,f,"8+ years of software development experience with a bachelor’s degree, 6+ years of software development experience with a master’s degree or 3+ years of software development experience with a phd • 2+ years of experience supervising software developers • experience managing front-end, web application development •knowledge of and hands-on capabilities with javascript • experience with extjs a major nice to have •a strong focus on user interface (ui) development and user experience (ux) methodologies • experienced with development methodologies such as agile, scrum or waterfall • experience with project management software, (ie atlassian tools such as jira and confluence) • ability to bring structure, accountability, transparency, and consistency to our front-end development team • strong project-driven mentality with an attitude towards shipping fast • ability to thrive in a fast-paced, entrepreneurial environment • ability to work very closely with director of product to implement vision • knowledge of core java technology is nice to have "
4183,t,"communication - communicates clearly and concisely, verbally and in writing customer orientation - establishes and maintains long-term customer relationships, building trust and respect by consistently meeting and exceeding expectations interpersonal skills - able to work effectively with other employees, patients and external parties pc skills - demonstrates proficiency in pc applications as required policies procedures - demonstrates knowledge and understanding of organizational policies, procedures and systems basic skills - able to perform basic mathematical calculations, balance and reconcile figures, punctuate properly, spell correctly and transcribe accurately "
6287,t,qualifications personal attributes time served engineer with strong track record in delivering process improvement and capital expenditure projects within an engineering based organisation.
11588,f,"we don't necessarily care how long you've been doing account and project management; more important is the passion and talent you bring to the table. with that said, it would be nice if you have the following experience: 5 to 7 years experience managing interactive projects someone with that canny ability to always think one step ahead to stop problems before they happen. deep experience with project management tools (ms project or omniplan) excellent project management skills including planning and estimation, client communication and resource allocation ability to generate project documentation including requirements, project plans, budget spreadsheets and resource tracking. ability to apply creative thinking to technology issues and problem solving curiosity to learn about new web technologies and approaches a team player who enjoys collaborating with others well-organized and able to work under deadlines and multiple projects. a highly motivated self-starter "
10788,f,"requirementsas a call center sales representative you should be driven to succeed and exceed customer service and sales goals. in this role you should have strong interpersonal communication skills with a confident and outgoing personality.additional requirements of the position include:• high school diploma or equivalent• 6 months’ experience in a sales or service related role• basic computer skills• excellent verbal and written communication skills• ability to utilize basic math computation skills, preferred• available monday through saturday 8:00am to 8:00pm• be willing to submit to a background check"
6295,f,nann
5347,f,nann
17696,t,"* training is provided * monthly and daily sales bonuses * gas bonuses and/or salary plus commission provided (depending upon experience) * valid drivers license, reliable car, and internet access is required. please send resume please no phone calls"
362,f,"candidates must have excellent: attention to detail and commitment to outstanding client service interpersonal skills to work with multiple clients and carriers ability to manage multiple tasks at the same time financial and analytical skills project management, time management and organizational skills needed to successfully manage multiple tasks and priorities computer skills; proficiency with excel and word education and experience requirements: a bachelor’s degree in business, risk management, healthcare management or a related field 2+ years of relevant work experience "
400,f,"the fit: we are looking for a new team member with talkative and outgoing personality. we are always nice to people and so should be you. while working hard, we still like to have fun and keep things relaxed. we think that feeling good while working is mega important so any activity in this direction will be supported :) experience is a plus: you should have worked with google adwords and have deployed a campaign there. you should know what is a “conversion rate” and “click through rate”. you should have at least some experience with google analytics. having experience with tutoring either as a tutor or a parent looking for tutoring for their kinds is a plus. do you like to write and communicate? did you write to school magazine, have your own blog etc. ? it could finally pay off :) bullets that didn't fit anywhere else :) you are from munich (or around) and speak german and english. you can imagine a great customer care and then make it reality. you can make independent decisions and explain them to other team members. you are looking for awesome experience and meeting new people. you are a self-driven person with huge motivation to market the platform in germany / austria and have knowledge of german market. "
4577,t,nann
